{"$schema":"https://json-schema.org/draft/2020-12/schema","$id":"https://fs-gg.github.io/schemas/evidence/reviews/v2","category":"reviews","$defs":{"digest":{"type":"string","pattern":"^[0-9a-f]{64}$"},"id":{"type":"string","pattern":"^[A-Za-z0-9][A-Za-z0-9._-]{0,127}$"},"revision":{"type":"string","pattern":"^[0-9a-f]{40}$"}},"type":"object","required":["accountableOwner","candidate","createdAt","digest","evidence","evidenceSetSha256","findings","rollup","schema"],"properties":{"accountableOwner":{"$ref":"#/$defs/id"},"candidate":{"type":"object","required":["commitSha","fingerprintSha256","treeSha256","unitContractSha256"],"properties":{"commitSha":{"$ref":"#/$defs/revision"},"fingerprintSha256":{"$ref":"#/$defs/digest"},"treeSha256":{"$ref":"#/$defs/digest"},"unitContractSha256":{"$ref":"#/$defs/digest"}},"additionalProperties":false},"createdAt":{"type":"string","format":"date-time"},"digest":{"$ref":"#/$defs/digest"},"evidence":{"type":"array","minItems":1,"uniqueItems":true,"items":{"type":"object","required":["id","sha256"],"properties":{"id":{"$ref":"#/$defs/id"},"sha256":{"$ref":"#/$defs/digest"}},"additionalProperties":false}},"evidenceSetSha256":{"$ref":"#/$defs/digest"},"findings":{"type":"array","minItems":5,"maxItems":5,"uniqueItems":true,"items":{"type":"object","required":["author","candidateFingerprintSha256","completedAt","contentSha256","decision","digest","evidenceSetSha256","id","perspective","phaseId"],"properties":{"author":{"$ref":"#/$defs/id"},"candidateFingerprintSha256":{"$ref":"#/$defs/digest"},"completedAt":{"type":"string","format":"date-time"},"contentSha256":{"$ref":"#/$defs/digest"},"decision":{"enum":["passed","changes-required"]},"digest":{"$ref":"#/$defs/digest"},"evidenceSetSha256":{"$ref":"#/$defs/digest"},"id":{"$ref":"#/$defs/id"},"perspective":{"enum":["adapter","architecture","cutover","migration","security"]},"phaseId":{"$ref":"#/$defs/id"}},"additionalProperties":false}},"rollup":{"type":"object","required":["acceptanceAuthority","accountableOwner","derivation","digest","findingSetSha256","outcome","passingPerspectives","requiredPerspectives"],"properties":{"acceptanceAuthority":{"const":"accountable-owner-only"},"accountableOwner":{"$ref":"#/$defs/id"},"derivation":{"const":"all-required-bound-green/1"},"digest":{"$ref":"#/$defs/digest"},"findingSetSha256":{"$ref":"#/$defs/digest"},"outcome":{"enum":["passed","changes-required"]},"passingPerspectives":{"type":"array","uniqueItems":true,"items":{"enum":["adapter","architecture","cutover","migration","security"]}},"requiredPerspectives":{"type":"array","minItems":5,"maxItems":5,"uniqueItems":true,"items":{"enum":["adapter","architecture","cutover","migration","security"]}}},"additionalProperties":false},"schema":{"const":"fsgg.coordination.critique-evidence/1"}},"additionalProperties":false}
