{"accountableOwner":"codex-accountable-delivery-owner","candidate":{"commitSha":"2427478b6fffba470e86ff46cf2ca22106a11a6d","fingerprintSha256":"d203c67468a22e020ab39adbb829023843e057f6530716e2822b2dcb5a325171","treeSha256":"9f8867ce29ce3092d13fea6f5eed9aaf7badc83315821077131d7673f8e0d61e","unitContractSha256":"c38b9ed4a473a99ee1bb6b43dddcafc06c153e6f1b698fbb44f45af018f52920"},"createdAt":"2026-08-31T00:05:09Z","digest":"8dd10b11537c46a6c3b2f6009bfad86334e71d351f0ce06f8345f19c1ddec2d0","evidence":[{"id":"hosted-runs","sha256":"244eeade56364d11a7f9efd5b6af3bf32b671273ba7846a131663abee6a2f413"},{"id":"main-bootstrap-evidence","sha256":"7d4eaa2fbc60d199b4b75c36bf18a254b41a50d48d8758e0b6cc2424cf188437"},{"id":"main-reuse-decision","sha256":"e9f955fb113351193199763f82d1be94e5b058b3a4ad15031cd8791dc9076806"},{"id":"pr-bootstrap-evidence","sha256":"72aabb5da85261397d872d7426876b88d2bd4077335250c2959a5b8fe727958f"},{"id":"qualification-subject","sha256":"0f9670e54714854be514540a3bd06a3c4d73e40a32827be7d6fbf68d0653f2f0"},{"id":"roadmap-candidate","sha256":"2a91f8e3a2cc5ddf765b7af2d4083ded55e52c15111b255ecc47813f78f7c772"},{"id":"roadmap-gates","sha256":"1b2e46abfe6b81e5bb1dea488be0773e0f2063f37a772597f5b1e9ba49832652"}],"evidenceSetSha256":"48f16c2af28b9de96f4bb2f01bf4968ff3cfdc1f44e76a5bc55ef40e1fe714ce","findings":[{"author":"codex-accountable-delivery-owner","candidateFingerprintSha256":"d203c67468a22e020ab39adbb829023843e057f6530716e2822b2dcb5a325171","completedAt":"2026-08-31T00:05:07Z","contentSha256":"a67f31ace815304d9fbff7327105c2ed42ee9497e167e2266dd15a4d39128b53","decision":"passed","digest":"483cfe084c05ad5c77f25424d2a242206094f447b14cb759504f84e98c74835c","evidenceSetSha256":"48f16c2af28b9de96f4bb2f01bf4968ff3cfdc1f44e76a5bc55ef40e1fe714ce","id":"gs2-03-8-adapter","perspective":"adapter","phaseId":"gs2-03-8-adapter-acceptance"},{"author":"codex-accountable-delivery-owner","candidateFingerprintSha256":"d203c67468a22e020ab39adbb829023843e057f6530716e2822b2dcb5a325171","completedAt":"2026-08-31T00:05:05Z","contentSha256":"5c8d9931123d106963b3194fb7d9c70651634ed73a1183dc877f4a416155f300","decision":"passed","digest":"85bbf0b124c025782e0dcbd5ffc9a26adf279643762e1f83eb0ab73dc1ce8fad","evidenceSetSha256":"48f16c2af28b9de96f4bb2f01bf4968ff3cfdc1f44e76a5bc55ef40e1fe714ce","id":"gs2-03-8-architecture","perspective":"architecture","phaseId":"gs2-03-8-architecture-acceptance"},{"author":"codex-accountable-delivery-owner","candidateFingerprintSha256":"d203c67468a22e020ab39adbb829023843e057f6530716e2822b2dcb5a325171","completedAt":"2026-08-31T00:05:09Z","contentSha256":"aacf816880178b4be9fdfb619cbcec35bd29f5acc9a0dd1064e7b11c0d1dfbe5","decision":"passed","digest":"7c79b5cdc42f65aedc8a4ee2326281f673ce6cbd24e033910fe6312bb9680233","evidenceSetSha256":"48f16c2af28b9de96f4bb2f01bf4968ff3cfdc1f44e76a5bc55ef40e1fe714ce","id":"gs2-03-8-cutover","perspective":"cutover","phaseId":"gs2-03-8-cutover-acceptance"},{"author":"codex-accountable-delivery-owner","candidateFingerprintSha256":"d203c67468a22e020ab39adbb829023843e057f6530716e2822b2dcb5a325171","completedAt":"2026-08-31T00:05:08Z","contentSha256":"fc57272a7e8e6ef8070361b7060ff3b87963d19f373cc7b23b3bdb26be988892","decision":"passed","digest":"9884a027be9c3132cc492f319f025c60c4c0da603b29191d17eebabcd72fd98d","evidenceSetSha256":"48f16c2af28b9de96f4bb2f01bf4968ff3cfdc1f44e76a5bc55ef40e1fe714ce","id":"gs2-03-8-migration","perspective":"migration","phaseId":"gs2-03-8-migration-acceptance"},{"author":"codex-accountable-delivery-owner","candidateFingerprintSha256":"d203c67468a22e020ab39adbb829023843e057f6530716e2822b2dcb5a325171","completedAt":"2026-08-31T00:05:06Z","contentSha256":"4e32eb442c598ec9bbbb45de4de69ea6b679bc1c52dc615967b632d4699ee7a6","decision":"passed","digest":"cd1064d01e0be17688ce9a18dae39956c8061966f195535db5ef5a78029074bf","evidenceSetSha256":"48f16c2af28b9de96f4bb2f01bf4968ff3cfdc1f44e76a5bc55ef40e1fe714ce","id":"gs2-03-8-security","perspective":"security","phaseId":"gs2-03-8-security-acceptance"}],"rollup":{"acceptanceAuthority":"accountable-owner-only","accountableOwner":"codex-accountable-delivery-owner","derivation":"all-required-bound-green/1","digest":"d4821029fc1c2eea7f2dfe2b2295429633b4332a5eb0bba2e25f53bbdb552e73","findingSetSha256":"d5bfc82512b82ec522ee7cf2798fc603da664c9c1a36dfbcf2dc8e1a311bf438","outcome":"passed","passingPerspectives":["adapter","architecture","cutover","migration","security"],"requiredPerspectives":["adapter","architecture","cutover","migration","security"]},"schema":"fsgg.coordination.critique-evidence/1"}
